<?xml version="1.0" encoding="utf-8"?>
<cardapio xmlns="cardapio.xml"
          xmlns:xsi="http://www.w3.org/2001/XMLSchema-instance"
          xsi:schemaLocation="cardapio.xml cardapio.xsd">
    <prato id="1">
        <nome>Pão de Queijo Mineiro</nome>
        <descricao>Delicioso pão de queijo tradicional de Minas Gerais</descricao>
        <ingredientes>
            <ingrediente>Polvilho</ingrediente>
            <ingrediente>Queijo Minas</ingrediente>
            <ingrediente>Leite</ingrediente>
        </ingredientes>
        <preco>15.00</preco>
        <calorias>150</calorias>
        <tempoPreparo>20 minutos</tempoPreparo>
    </prato>
    <prato id="2">
        <nome>Feijoada Completa</nome>
        <descricao>Prato tradicional brasileiro com feijão preto e variedade de carnes</descricao>
        <ingredientes>
            <ingrediente>Feijão preto</ingrediente>
            <ingrediente>Linguiça</ingrediente>
            <ingrediente>Costela</ingrediente>
            <ingrediente>Couve</ingrediente>
        </ingredientes>
        <preco>45.00</preco>
        <calorias>850</calorias>
        <tempoPreparo>240 minutos</tempoPreparo>
    </prato>
    <prato id="3">
        <nome>Brigadeiro Gourmet</nome>
        <descricao>Doce brasileiro com chocolate 70% e granulado especial</descricao>
        <ingredientes>
            <ingrediente>Chocolate amargo</ingrediente>
            <ingrediente>Leite condensado</ingrediente>
            <ingrediente>Manteiga</ingrediente>
        </ingredientes>
        <preco>8.00</preco>
        <calorias>120</calorias>
        <tempoPreparo>25 minutos</tempoPreparo>
    </prato>
</cardapio>